code,category_code,sub_category_code,image_code,title,description,info,is_hide
1,1,1,5,Rubyのeachメソッドで要素の番号を取得する方法,Rubyのeachメソッドは配列やハッシュの要素を順番に取り出すことができます。さらに、取り出す要素が何番目のものかを取得する方法を教えます。,"<p>まずは、eachメソッドの使い方を紹介します。</p><br /><pre><code>配列のデータ.each do |変数|<br />  処理内容<br />end<br /></code></pre><br /><p>配列の要素分の処理を繰り返すときに使用するメソッドです。</p><br /><br /><p class=""uk-heading-bullet"">サンプル</p><br /><pre><code>seasons = [""Spring"", ""Summer"", ""Autumn"", ""Winter""]<br />seasons.each do |season|<br />  puts season<br />end<br /></code></pre><br /><br /><p class=""uk-heading-bullet"">実行結果</p><br /><pre><code>Spring<br />Summer<br />Autumn<br />Winter<br /></code></pre><br /><p>配列の要素を1つずつ取得することができます。しかし、この方法では何番目の要素かを判断することが出来ません。取り出す要素が何番目のものかを取得する場合は、each_with_indexメソッドを使いましょう。</p><br /><br /><p>each_with_indexメソッドの使い方を紹介します。</p><br /><pre><code>配列のデータ.each_with_index do |変数, インデックス|<br />  処理内容<br />end<br /></code></pre><br /><br /><p class=""uk-heading-bullet"">サンプル</p><br /><pre><code>seasons = [""Spring"", ""Summer"", ""Autumn"", ""Winter""]<br />seasons.each_with_index do |season, i|<br />  puts ""#{i} = #{season}""<br />end<br /></code></pre><br /><br /><p class=""uk-heading-bullet"">実行結果</p><br /><pre><code>0 = Spring<br />1 = Summer<br />2 = Autumn<br />3 = Winter<br /></code></pre><br /><br /><p>i には番号が入ります。インデックスは、0から始まる整数です。要素が増える毎に1ずつ増えていきます。each_with_indexメソッドは、ランキングの表示や奇数偶数の判断でCSSの変更など使い道は色々あります。</p><br /><p>each_with_indexメソッドの初期値は0から始まりますが、その初期値を変更することも可能です。その場合は、each.with_indexメソッドを使います。eachとwithの間に「_（アンダーライン）」「.（ドット）」に違いがありますので気をつけましょう。</p><br /><br /><p>each.with_indexメソッドの使い方を紹介します。</p><br /><p class=""uk-heading-bullet"">サンプル</p><br /><pre><code>seasons = [""Spring"", ""Summer"", ""Autumn"", ""Winter""]<br />seasons.each.with_index(1) do |season, i|<br />  puts ""#{i} = #{season}""<br />end<br /></code></pre><br /><br /><p class=""uk-heading-bullet"">実行結果</p><br /><pre><code>1 = Spring<br />2 = Summer<br />3 = Autumn<br />4 = Winter<br /></code></pre><br /><br /><p>この方法を使うことで初期値を0以外に変更することが出来ます。each_with_index(1)で引数を渡すとエラーになりますので気をつけましょう。</p><br />",false
2,2,3,4,"AWS, Nginx, Rails, Pumaで「502 Bad Gateway」の対応方法","AWS, Nginx, Rails, Pumaを連携したときに「502 Bad Gateway」の画面が表示された。この対応方法についてNginxの設定を修正することにより解消することが出来ました。","<p>nginxのログを確認すると以下の内容が出力されていた。</p><br /><br /><pre><code>2020/01/18 07:39:19 [crit] 17617#0: *82 connect() to unix:/home/xxx/xxx/tmp/sockets/puma.sock failed (13: Permission denied) while connecting to upstream, <br />client: xxx.xx.xx.xx, server: xxxxxx.xxx, request: \""GET / HTTP/1.1\"", upstream: \""http://unix:/home/xxx/xxx/tmp/sockets/puma.sock:/500.html\"", host: \""xxxxxxx.xxx\""</code></pre><br /><br /><p>ブラウザの画面も「502 Bad Gateway」と表示されている。どうやらnginxとPumaが上手く繋がっていないようでした。</p><br /><p>nginxとPumaの実行しているユーザが異なっているため今回のエラーが出ていることが分かりました。nginx.confの設定のuserの部分をPumaを実行しているユーザに合わせることによってエラーが解消されました。</p><br /><br /><p class=""uk-heading-bullet"">/etc/nginx/nginx.conf （今回のユーザは""ec-user""とする）</p><br /><pre><code># For more information on configuration, see:<br />#   * Official English Documentation: http://nginx.org/en/docs/<br />#   * Official Russian Documentation: http://nginx.org/ru/docs/<br /><br />#user nginx;<br />user ec-user;<br />worker_processes auto;<br />error_log /var/log/nginx/error.log;<br />pid /var/run/nginx.pid;<br /></code></pre><br /><br /><p class=""uk-heading-bullet"">$ ps ux</p><br /><pre><code>USER       PID %CPU %MEM    VSZ   RSS TTY      STAT START   TIME COMMAND<br />ec-user  5928  2.7  9.3 959188 93920 pts/1    Sl+  06:43   0:01 puma 4.3.1 (unix:///home/xxx/xxx/tmp/sockets/puma.sock) [xxx]                                     <br />ec-user  5966  0.0  0.2 117244  2188 pts/0    R+   06:43   0:00 ps ux<br />ec-user 23024  0.0  0.3  59788  3976 ?        S    04:10   0:00 nginx: worker process   <br /></code></pre><br /><br /><p>設定を変更したことにより「502 Bad Gateway」の画面が表示されなくなり、Railsのアプリケーションも無事に繋がりました。</p>",false
3,2,3,6,Nginx+Rails+Puma+AWSで「13: Permission Denied)」で画像が読み込めなかったときの対応方法,RailsのアプリケーションをNginxとPumaを使ってアプリは動かすことが出来たが、画像のみが表示されなかった。/var/lib/nginx のアクセス権限を変更しなければいけなかったようです。,"<p>nginxのログを確認すると以下の内容が出力されていた。</p><br /><br /><pre><code>2020/01/18 08:45:24 [crit] 19454#0: *63 open() ""/var/lib/nginx/tmp/proxy/5/00/0000000005"" failed (13: Permission denied) while reading upstream, <br />client: xxx.xx.xx.xxx, server: xxxxxx.xxx, request: ""GET /image/show_image/5 HTTP/1.1"", upstream: ""http://unix:/home/xxx/xxx/tmp/sockets/puma.sock:/image/show_image/5"", host: ""xxxxxx.xxx"", referrer: ""http://xxxxxx.xxx/""</code></pre><br /><br /><p>JSやCSSなどは読み込めていたが、画像のみだけが上手く表示出来なかった。</p><br /><p>RailsとPumaを動かすために nginx.conf ファイルのuserを変更して nginx の実行ユーザを変えたが、/var/lib/nginxのアクセス権限が変わっていなかったようです。それにより、キャッシュへアクセスが出来なかったのが原因だったようです。</p><br /><br /> <p>/var/lib/nginxのアクセス権限をnginx.conf ファイルで設定したuserと同じユーザに変更したことにより、今回の問題は解決しました。無事に画像も表示することが出来ました。</p><br /><br />",false
4,1,2,7,【Rails 6】favicon を設定する方法,favicon_link_tag メソッドを使うと簡単に favicon を設定することが出来ます。faviconを簡単に作成できるサイトや置き場所、設定方法を教えます。,"<p class=""uk-heading-bullet"">環境</p><br /><pre><code>$ ruby -v<br />ruby 2.7.0p0 (2019-12-25 revision 647ee6f091) [x86_64-linux]<br /><br />$ rails -v<br />Rails 6.0.2.1<br /></code></pre><br /><br /><p class=""uk-heading-bullet"">favicon.icoの用意</p><br /><p>以下のサイトでfavicon.icoのファイルを簡単に作ることが出来ます。Faviconジェネレーターは、ブラウザ上で、JPEG, PNG, GIF などの画像ファイルから favicon 用の画像(favicon.ico)を生成・変換するサービスです。まずは、faviconにしたい画像を用意しましょう。</p><br /><p><a href=""https://favicon-generator.mintsu-dev.com/"" target=""_blank"">Favicon ジェネレーター</a></p><br /><br /><p>画像が作る方が苦手な方は以下のサイトを利用してはどうでしょうか。商用利用可能なアイコン素材をフリー(無料)ダウンロードできる素材配布サイトです。あなたのサイトに合ったアイコンを見つけることが出来るかもしれません。</p><br /><p><a href=""https://icooon-mono.com/"" target=""_blank"">ICOOON MONO</a></p><br /><br /><p class=""uk-heading-bullet"">favicon.icoの設置</p><br /><p>favicon_link_tag メソッドを使うことで、favicon を指定することが出来ます。favicon.icoの置き場所 は app/assets/images 以下に置きましょう。</p><br /><br /><p>app/views/layouts/application.html.erbに以下のコードを設置する。</p><br /><pre><code>&lt;%= favicon_link_tag '/favicon.ico' %&gt;<br /># => &lt;link rel=""shortcut icon"" type=""image/x-icon"" href=""/assets/favicon.ico"" /&gt;<br /></code></pre><br /><br /><p>以上です。favicon_link_tagを使うとfaviconを簡単に設置出来ます。</p><br /><br />",false
5,3,4,2,Webサイトで英語がはみ出る場合の対処方法・折返し方法について,Webサイトで英字がはみ出ているのを気づいたことありませんか？スマホ画面で英字がはみ出ているサイトを見かけます。これは、CSSのword-breakとword-wrapを使うと対応出来ます。,"<p>半角英数が連続した文字を表示すると、指定した枠からはみ出ることがあります。例えば、リンクテキストの長いURLやハッシュ値などがあります。</p><br /><p>この問題は、CSSで対応することが出来ます。word-break: break-all;とword-wrap: break-word;（overflow-wrapに改名された）のどちらかを使うことによって英語を折り返すことが出来ます。</p><br /><br /><p class=""uk-heading-bullet"">例：word-break</p><br /><pre><code>body{<br />  word-break: break-all;<br />}<br /></code></pre><br /><p>word-break: break-all;は、英語の単語の途中であっても折り返します。必ず右端で文字を折返してくれます。右端で ""ok"" のような短い単語の途中であっても、""o""と""k""で折り返します。英単語によっては違和感のある文章になる可能性があります。デザイン中心で考えたい場合はこちらを使うのがおすすめです。</p><br /><br /><p class=""uk-heading-bullet"">例：word-wrap（overflow-wrap）</p><br /><pre><code>body{<br />  word-wrap: break-word;<br />  overflow-wrap: break-word;<br />}<br /></code></pre><br /><p>word-wrap: break-word;は、英語の単語の途中で折り返さないようにします。指定した枠内に収まれば、単語の途中では折り返さないようになります。必ず右端ぴったりで改行してくれるわけではありませんので、少しの隙間が出来る可能性があります。文体を意識したいときはこちらを使うのがおすすめです。</p><br /><p>overflow-wrapも入れといてあります。CSS3の最新の仕様案ではword-warpを改め、overflow-wrapとして提案されているそうです。</p><br /><br /><p>つまり、二つの違いは、英語の単語を途中で切るか切らないかの違いです。用途に合わせて使い分けましょう。</p><br /><br /><br />",false
